{
 "format": "meridian.contact",
 "version": "v1",
 "caveat": "\"First contact\" is a European frame. These years record when Europeans arrived and wrote it\ndown; the peoples already living here had their own long histories of these encounters, and of\nthe places and routes Europeans then claimed to have discovered. Contact also usually arrived\nbefore Europeans did: trade goods, horses and above all epidemic disease moved along Indigenous\nnetworks decades ahead of any European traveller — the smallpox epidemic of 1780–82 reached the\nnorthern Plains through Indigenous trade and warfare routes and killed a large share of the\npopulation in country no European had yet visited. The dates are uneven in kind as well: some\nmark a ship passing offshore, others a wintering or a permanent post, and in the far north and\nthe deep interior they are the best documented guess rather than a record of what happened first.",
 "bands": [
  {
   "label": "Before 1500",
   "fromYear": null,
   "untilYear": 1500,
   "geometryRef": "contact_start_1500"
  },
  {
   "label": "1500–1599",
   "fromYear": 1500,
   "untilYear": 1600,
   "geometryRef": "contact_1500_1600"
  },
  {
   "label": "1600–1699",
   "fromYear": 1600,
   "untilYear": 1700,
   "geometryRef": "contact_1600_1700"
  },
  {
   "label": "1700–1799",
   "fromYear": 1700,
   "untilYear": 1800,
   "geometryRef": "contact_1700_1800"
  },
  {
   "label": "1800–1899",
   "fromYear": 1800,
   "untilYear": 1900,
   "geometryRef": "contact_1800_1900"
  },
  {
   "label": "1900 and after",
   "fromYear": 1900,
   "untilYear": null,
   "geometryRef": "contact_1900_now"
  }
 ],
 "regions": [
  {
   "id": "basin_pacific_coastal",
   "name": "Pacific coastal basin",
   "year": 1793,
   "event": "Mackenzie reaches salt water at Bella Coola, 22 July 1793",
   "confidence": 0.7,
   "source": "https://www.thecanadianencyclopedia.ca/en/article/sir-alexander-mackenzie-explorer"
  },
  {
   "id": "basin_fraser",
   "name": "Fraser and Lower Mainland",
   "year": 1808,
   "event": "Simon Fraser descends the river to the Strait of Georgia, May–July 1808",
   "confidence": 0.85,
   "source": "https://www.biographi.ca/en/bio/fraser_simon_9E.html"
  },
  {
   "id": "basin_okanagan",
   "name": "Okanagan and Similkameen",
   "year": 1811,
   "event": "David Stuart travels north from Fort Okanogan into the Okanagan, 1811; Fort Kamloops 1812",
   "confidence": 0.5,
   "source": "https://www.thecanadianencyclopedia.ca/en/article/kamloops"
  },
  {
   "id": "basin_columbia",
   "name": "Columbia and Kootenay",
   "year": 1807,
   "event": "David Thompson crosses Howse Pass and builds Kootenae House on the upper Columbia, 1807",
   "confidence": 0.75,
   "source": "https://www.biographi.ca/en/bio/thompson_david_8E.html"
  },
  {
   "id": "basin_yukon",
   "name": "Yukon basin",
   "year": 1843,
   "event": "Robert Campbell descends the Pelly, 1843; Fort Selkirk 1848",
   "confidence": 0.6,
   "source": "https://www.biographi.ca/en/bio/campbell_robert_1808_94_12E.html"
  },
  {
   "id": "basin_peace_athabasca",
   "name": "Peace and Athabasca",
   "year": 1778,
   "event": "Peter Pond crosses Methye Portage and winters on the Athabasca, 1778–79",
   "confidence": 0.85,
   "source": "https://www.thecanadianencyclopedia.ca/en/article/peter-pond"
  },
  {
   "id": "basin_lower_mackenzie",
   "name": "Lower Mackenzie",
   "year": 1805,
   "event": "Fort Good Hope, 1805; Fort Norman and Great Bear, 1810",
   "confidence": 0.5,
   "source": "https://www.thecanadianencyclopedia.ca/en/article/fort-good-hope"
  },
  {
   "id": "basin_arctic",
   "name": "Arctic coast and islands",
   "year": 1913,
   "event": "The Canadian Arctic Expedition, 1913–18, and the police posts of the 1900s–20s",
   "confidence": 0.4,
   "source": "https://www.thecanadianencyclopedia.ca/en/article/canadian-arctic-expedition",
   "note": "A deliberate backstop for the parts of the archipelago nothing more specific covers. Every island entry below improves it."
  },
  {
   "id": "basin_missouri",
   "name": "Canadian Missouri (Milk River)",
   "year": 1792,
   "event": "Peter Fidler winters with the Piikani, 1792–93 — the nearest documented presence",
   "confidence": 0.35,
   "source": "https://www.biographi.ca/en/bio/fidler_peter_6E.html",
   "note": "The weakest entry in this file. No documented European presence in the Canadian Missouri basin before the 19th century was found; Fidler was probably north of it. Needs a specialist source."
  },
  {
   "id": "basin_north_saskatchewan",
   "name": "North Saskatchewan",
   "year": 1754,
   "event": "Anthony Henday's journey of 1754–55, the first European in what is now Alberta",
   "confidence": 0.8,
   "source": "https://www.biographi.ca/en/bio/henday_anthony_3E.html"
  },
  {
   "id": "basin_south_saskatchewan",
   "name": "South Saskatchewan",
   "year": 1787,
   "event": "David Thompson winters with the Piikani on the Bow, 1787–88",
   "confidence": 0.5,
   "source": "https://www.biographi.ca/en/bio/thompson_david_8E.html",
   "note": "Both candidate anchors (Thompson 1787, Fidler 1792) are winters spent with the Piikani, so contact plainly predated them through Cree and Assiniboine middlemen and the French posts on the lower Saskatchewan."
  },
  {
   "id": "basin_assiniboine_red",
   "name": "Assiniboine and Red",
   "year": 1738,
   "event": "La Vérendrye builds Fort Rouge and Fort La Reine, October 1738",
   "confidence": 0.85,
   "source": "https://www.biographi.ca/en/bio/gaultier_de_varennes_et_de_la_verendrye_pierre_3E.html"
  },
  {
   "id": "basin_winnipeg",
   "name": "Winnipeg River and Rainy Lake",
   "year": 1731,
   "event": "Fort Saint-Pierre on Rainy Lake, 1731",
   "confidence": 0.9,
   "source": "https://www.biographi.ca/en/bio/gaultier_de_varennes_et_de_la_verendrye_pierre_3E.html",
   "note": "Jacques de Noyon is said to have wintered on Rainy Lake in 1688, but the account is a late second-hand deposition, so the documented post of 1731 is used instead."
  },
  {
   "id": "basin_lower_saskatchewan_nelson",
   "name": "Lower Saskatchewan and Nelson",
   "year": 1690,
   "event": "Henry Kelsey travels inland from York Factory, 1690–92",
   "confidence": 0.8,
   "source": "https://www.biographi.ca/en/bio/kelsey_henry_2E.html"
  },
  {
   "id": "basin_churchill",
   "name": "Churchill River basin",
   "year": 1774,
   "event": "Frobisher at Frog Portage, 1774; Île-à-la-Crosse, 1776",
   "confidence": 0.6,
   "source": "https://www.biographi.ca/en/bio/frobisher_joseph_5E.html"
  },
  {
   "id": "basin_keewatin",
   "name": "Keewatin and southern Baffin",
   "year": 1893,
   "event": "J. B. Tyrrell descends the Dubawnt and Kazan, 1893–94, and meets the Ahiarmiut",
   "confidence": 0.7,
   "source": "https://fisher.library.utoronto.ca/tyrrell-explorer-and-adventurer"
  },
  {
   "id": "basin_northern_ontario",
   "name": "Northern Ontario",
   "year": 1743,
   "event": "Henley House, 1743, the first inland post; Osnaburgh, 1786",
   "confidence": 0.5,
   "source": "https://www.thecanadianencyclopedia.ca/en/article/hudsons-bay-company",
   "note": "Thin. Henley House is a post, not a contact: traders and Indigenous middlemen moved through this country from the 1670s and the true date is almost certainly earlier."
  },
  {
   "id": "basin_northern_quebec",
   "name": "Northern Quebec",
   "year": 1830,
   "event": "HBC inland posts of the 1830s; A. P. Low's surveys, 1890s",
   "confidence": 0.4,
   "source": "https://pubs.aina.ucalgary.ca/arctic/Arctic39-3-274.pdf"
  },
  {
   "id": "basin_great_lakes",
   "name": "Great Lakes basin",
   "year": 1669,
   "event": "Dollier and Galinée winter at Long Point, 1669–70",
   "confidence": 0.6,
   "source": "https://www.biographi.ca/en/bio/galinee_rene_bre_1E.html"
  },
  {
   "id": "basin_ottawa",
   "name": "Ottawa valley",
   "year": 1613,
   "event": "Champlain ascends the Ottawa to Allumette Island, 1613",
   "confidence": 0.85,
   "source": "https://www.thecanadianencyclopedia.ca/en/article/samuel-de-champlain"
  },
  {
   "id": "basin_st_lawrence",
   "name": "St. Lawrence basin",
   "year": 1647,
   "event": "Jean de Quen reaches Lac Saint-Jean, 1647; the Chicoutimi post, 1676",
   "confidence": 0.6,
   "source": "https://www.biographi.ca/en/bio/quen_jean_de_1E.html",
   "note": "The basin's interior, not its river: Cartier's 1535 voyage is the corridor entry below. The 1647 date for the Saguenay interior is universally repeated but was not checked against the Dictionary of Canadian Biography in the pass that produced this file."
  },
  {
   "id": "basin_north_shore_gaspe",
   "name": "North Shore and Gaspé",
   "year": 1534,
   "event": "Cartier's first voyage coasts the Gulf's north shore and raises a cross at Gaspé, July 1534",
   "confidence": 0.85,
   "source": "https://www.thecanadianencyclopedia.ca/en/article/jacques-cartier"
  },
  {
   "id": "basin_saint_john",
   "name": "Saint John and St. Croix",
   "year": 1604,
   "event": "de Monts and Champlain at Île Sainte-Croix, 26 June 1604; the Saint John named that month",
   "confidence": 0.85,
   "source": "https://www.thecanadianencyclopedia.ca/en/article/ile-ste-croix-the-birth-of-acadia-feature"
  },
  {
   "id": "basin_maritime_coastal",
   "name": "Maritime coastal",
   "year": 1604,
   "event": "The Acadian coast of the de Monts expedition, 1604–05",
   "confidence": 0.85,
   "source": "https://archives.novascotia.ca/habitation/"
  },
  {
   "id": "basin_newfoundland_labrador",
   "name": "Newfoundland and Labrador interior",
   "year": 1893,
   "event": "A. P. Low's Geological Survey traverse of the Labrador peninsula, 1893–95",
   "confidence": 0.55,
   "source": "https://pubs.aina.ucalgary.ca/arctic/Arctic39-3-274.pdf"
  },
  {
   "id": "lanse_aux_meadows",
   "name": "L'Anse aux Meadows",
   "year": 1000,
   "event": "The Norse outpost at L'Anse aux Meadows, radiocarbon 990–1050, one felling dated to 1021",
   "confidence": 0.8,